{
  "by_content_id": {
    "2026-05-23-aml": {
      "bloom_levels": [
        "remember",
        "understand",
        "apply",
        "analyze",
        "evaluate"
      ],
      "checksum": "03f017460a0c3735ed581ea17ca647d506b5d4a7254bdfb87ca29453015345f6",
      "content_id": "2026-05-23-aml",
      "created_at": "2026-05-23T12:49:26Z",
      "date": "2026-05-23",
      "flashcards_count": 48,
      "path": "content/pl/blog/2026-05-23-aml/manifest.json",
      "pillar": "aml",
      "post_path": "content/pl/blog/2026-05-23-aml/index.md",
      "published_at": "2026-05-23T12:49:26Z",
      "quality_flags": [
        "no_trending"
      ],
      "questions_count": 4,
      "story_count": 30,
      "title": "London Mayor Blocks Palantir -- 🛡️ AML 2026-05-23"
    },
    "2026-05-23-science": {
      "bloom_levels": [
        "understand",
        "apply",
        "evaluate"
      ],
      "checksum": "17581bfd6b58dc1e7efd52df9405629b0208cb652b7cefa956ea2abe57fed6cd",
      "content_id": "2026-05-23-science",
      "created_at": "2026-05-23T12:49:29Z",
      "date": "2026-05-23",
      "flashcards_count": 44,
      "path": "content/pl/blog/2026-05-23-science/manifest.json",
      "pillar": "science",
      "post_path": "content/pl/blog/2026-05-23-science/index.md",
      "published_at": "2026-05-23T12:49:29Z",
      "quality_flags": [
        "no_trending"
      ],
      "questions_count": 4,
      "story_count": 30,
      "title": "Bun support is now limited and deprecated -- 🧬 SCIENCE 2026-05-23"
    },
    "2026-05-23-stock": {
      "bloom_levels": [
        "remember",
        "understand",
        "apply",
        "analyze",
        "evaluate"
      ],
      "checksum": "6be4102fd4d33270b3b5c0daf3bd25fac14b2627f9a72de477af84f4fd35c138",
      "content_id": "2026-05-23-stock",
      "created_at": "2026-05-23T12:49:27Z",
      "date": "2026-05-23",
      "flashcards_count": 42,
      "path": "content/pl/blog/2026-05-23-stock/manifest.json",
      "pillar": "stock",
      "post_path": "content/pl/blog/2026-05-23-stock/index.md",
      "published_at": "2026-05-23T12:49:27Z",
      "quality_flags": [
        "no_trending"
      ],
      "questions_count": 5,
      "story_count": 30,
      "title": "Googles Antigravity bait and switch -- 📈 STOCK 2026-05-23"
    },
    "2026-05-26-aml": {
      "bloom_levels": [
        "understand",
        "analyze",
        "evaluate"
      ],
      "checksum": "905a0e3fd228e31a261c2c1928b3b65182a1ec9633c906afb58c845c6a76ee5f",
      "content_id": "2026-05-26-aml",
      "created_at": "2026-05-26T15:49:26Z",
      "date": "2026-05-26",
      "flashcards_count": 20,
      "path": "content/pl/blog/2026-05-26-aml/manifest.json",
      "pillar": "aml",
      "post_path": "content/pl/blog/2026-05-26-aml/index.md",
      "published_at": "2026-05-26T15:49:26Z",
      "quality_flags": [
        "no_trending"
      ],
      "questions_count": 4,
      "story_count": 26,
      "title": "How Shamirs Secret Sharing Works -- 🛡️ AML 2026-05-26"
    },
    "2026-05-26-science": {
      "bloom_levels": [
        "remember",
        "understand",
        "apply",
        "analyze",
        "evaluate"
      ],
      "checksum": "601ce7e5fcba8e4f068a240f1154f11ceda4a78bee21b8f66e525138c8cbccce",
      "content_id": "2026-05-26-science",
      "created_at": "2026-05-26T15:49:28Z",
      "date": "2026-05-26",
      "flashcards_count": 29,
      "path": "content/pl/blog/2026-05-26-science/manifest.json",
      "pillar": "science",
      "post_path": "content/pl/blog/2026-05-26-science/index.md",
      "published_at": "2026-05-26T15:49:28Z",
      "quality_flags": [
        "no_trending"
      ],
      "questions_count": 5,
      "story_count": 30,
      "title": "Exit IP VPN servers mitigation rollout -- 🧬 SCIENCE 2026-05-26"
    },
    "2026-05-26-stock": {
      "bloom_levels": [
        "understand",
        "analyze",
        "evaluate"
      ],
      "checksum": "c4fd0eeca5602def5530cf727d0726f090bd5732802864af70a67fdd22a15d63",
      "content_id": "2026-05-26-stock",
      "created_at": "2026-05-26T15:49:27Z",
      "date": "2026-05-26",
      "flashcards_count": 20,
      "path": "content/pl/blog/2026-05-26-stock/manifest.json",
      "pillar": "stock",
      "post_path": "content/pl/blog/2026-05-26-stock/index.md",
      "published_at": "2026-05-26T15:49:27Z",
      "quality_flags": [
        "no_trending"
      ],
      "questions_count": 4,
      "story_count": 30,
      "title": "California moves to exempt Linux from its age-verification law after backlash -- 📈 STOCK 2026-05-26"
    },
    "2026-05-27-aml": {
      "bloom_levels": [
        "understand",
        "apply",
        "analyze",
        "evaluate",
        "create"
      ],
      "checksum": "49658ad3c361387bad1ca9ff18fa87ee7f67859931b66fafcce414b796c9bce2",
      "content_id": "2026-05-27-aml",
      "created_at": "2026-05-27T05:35:50Z",
      "date": "2026-05-27",
      "flashcards_count": 31,
      "path": "content/pl/blog/2026-05-27-aml/manifest.json",
      "pillar": "aml",
      "post_path": "content/pl/blog/2026-05-27-aml/index.md",
      "published_at": "2026-05-27T05:35:50Z",
      "quality_flags": [
        "no_trending"
      ],
      "questions_count": 5,
      "story_count": 30,
      "title": "Spain blocks prediction markets Polymarket, Kalshi over lack of gambling licence -- 🛡️ AML 2026-05-27"
    },
    "2026-05-27-science": {
      "bloom_levels": [
        "remember",
        "understand",
        "apply",
        "analyze",
        "evaluate"
      ],
      "checksum": "59640e362158dcfa22c7474fe179fdc923197568632585730347bba6a51cce3f",
      "content_id": "2026-05-27-science",
      "created_at": "2026-05-27T05:35:52Z",
      "date": "2026-05-27",
      "flashcards_count": 37,
      "path": "content/pl/blog/2026-05-27-science/manifest.json",
      "pillar": "science",
      "post_path": "content/pl/blog/2026-05-27-science/index.md",
      "published_at": "2026-05-27T05:35:52Z",
      "quality_flags": [
        "no_trending"
      ],
      "questions_count": 5,
      "story_count": 30,
      "title": "Exit IP VPN servers mitigation rollout -- 🧬 SCIENCE 2026-05-27"
    },
    "2026-05-27-stock": {
      "bloom_levels": [
        "understand",
        "analyze",
        "evaluate"
      ],
      "checksum": "cd13602455cf6091840701eadc840b3845a4a02c9ff9444f2a822926c95be1cb",
      "content_id": "2026-05-27-stock",
      "created_at": "2026-05-27T05:35:51Z",
      "date": "2026-05-27",
      "flashcards_count": 24,
      "path": "content/pl/blog/2026-05-27-stock/manifest.json",
      "pillar": "stock",
      "post_path": "content/pl/blog/2026-05-27-stock/index.md",
      "published_at": "2026-05-27T05:35:51Z",
      "quality_flags": [
        "no_trending"
      ],
      "questions_count": 5,
      "story_count": 30,
      "title": "California moves to exempt Linux from its age-verification law after backlash -- 📈 STOCK 2026-05-27"
    },
    "2026-05-28-aml": {
      "bloom_levels": [
        "understand",
        "apply",
        "analyze",
        "evaluate",
        "create"
      ],
      "checksum": "7c90af5287b2350ec4e3ca6147c5a5297c32a6b40f883d821b4459716db4a698",
      "content_id": "2026-05-28-aml",
      "created_at": "2026-05-28T08:19:07Z",
      "date": "2026-05-28",
      "flashcards_count": 31,
      "path": "content/pl/blog/2026-05-28-aml/manifest.json",
      "pillar": "aml",
      "post_path": "content/pl/blog/2026-05-28-aml/index.md",
      "published_at": "2026-05-28T08:19:07Z",
      "quality_flags": [
        "no_trending"
      ],
      "questions_count": 5,
      "story_count": 30,
      "title": "Spain blocks prediction markets Polymarket, Kalshi over lack of gambling licence -- 🛡️ AML 2026-05-28"
    },
    "2026-05-28-science": {
      "bloom_levels": [
        "understand",
        "apply",
        "analyze",
        "evaluate",
        "create"
      ],
      "checksum": "705acc0771cc651cd1361d50e7cc295181614506a7ed31d2c62513f3d3ce82b7",
      "content_id": "2026-05-28-science",
      "created_at": "2026-05-28T08:19:11Z",
      "date": "2026-05-28",
      "flashcards_count": 40,
      "path": "content/pl/blog/2026-05-28-science/manifest.json",
      "pillar": "science",
      "post_path": "content/pl/blog/2026-05-28-science/index.md",
      "published_at": "2026-05-28T08:19:11Z",
      "quality_flags": [
        "no_trending"
      ],
      "questions_count": 6,
      "story_count": 30,
      "title": "I think Anthropic and OpenAI have found product-market fit -- 🧬 SCIENCE 2026-05-28"
    },
    "2026-05-28-stock": {
      "bloom_levels": [
        "remember",
        "understand",
        "apply",
        "analyze",
        "evaluate"
      ],
      "checksum": "613cf212989f4667353f423cb77d6b93e862598c8085fe79ba4b8722a266c0c4",
      "content_id": "2026-05-28-stock",
      "created_at": "2026-05-28T08:19:09Z",
      "date": "2026-05-28",
      "flashcards_count": 37,
      "path": "content/pl/blog/2026-05-28-stock/manifest.json",
      "pillar": "stock",
      "post_path": "content/pl/blog/2026-05-28-stock/index.md",
      "published_at": "2026-05-28T08:19:09Z",
      "quality_flags": [
        "no_trending"
      ],
      "questions_count": 5,
      "story_count": 30,
      "title": "DuckDuckGo search saw 28% more visits after Google said people love AI mode -- 📈 STOCK 2026-05-28"
    }
  },
  "by_run_id": {
    "20260523T124923Z": {
      "checksum": "2824a9dcb7dcc09418ec98dbed3316e47bf9c519bf829e81d2ce567e800f3d3c",
      "created_at": "2026-05-23T12:49:29Z",
      "ended_at": "2026-05-23T12:49:29Z",
      "output_count": 3,
      "path": "registry/runs/20260523T124923Z.json",
      "run_id": "20260523T124923Z",
      "source_counts": {
        "arxiv": 100,
        "hn": 1000
      },
      "started_at": "2026-05-23T12:49:23Z",
      "status": "ok"
    },
    "20260523T140435Z": {
      "checksum": "db7c01205086e44a83ae34dbad0d40acea0204f9b1464b54b2ba46e62b38c078",